{
  "contract": "mem.doctor",
  "schema_version": 1,
  "server": "http://127.0.0.1:PORT",
  "cli_version": "0.1.0",
  "server_version": "0.1.0",
  "exit_code": 0,
  "checks": [
    {
      "name": "server_reachability",
      "status": "ok",
      "exit_code": 0,
      "detail": "healthz ok at http://127.0.0.1:PORT"
    },
    {
      "name": "credential",
      "status": "ok",
      "exit_code": 0,
      "detail": "token present (from $MEM_TOKEN)"
    },
    {
      "name": "workspace",
      "status": "ok",
      "exit_code": 0,
      "detail": "server-resolved workspace Personal (11111111-1111-1111-1111-111111111111), role owner; none configured locally, using the server default"
    },
    {
      "name": "version_skew",
      "status": "ok",
      "exit_code": 0,
      "detail": "CLI and server both report 0.1.0"
    }
  ]
}
